Handle,Title,Body (HTML),Vendor,Type,Tags,Published,Variant Price,Variant Compare At Price,Variant Requires Shipping,Variant Taxable,Image Src
ws2811-led-strip-12v-5m,"12V WS2811 RGB LED Streifen 5m","<p>Verwandle jeden Raum mit dem <strong>12V WS2811 RGB LED Streifen</strong>! Individuell steuerbar, 30 LEDs pro Meter, ideal für Wohnzimmer, Gaming-Setup, Bars und Dekorationen. Lieferumfang: 5m LED Strip + Netzteil.</p><ul><li>30 LED/m, 12V Niederspannung</li><li>Vollfarb-RGB, individuell adressierbar</li><li>Flexibel, zuschneidbar alle 3 LEDs</li><li>Lieferzeit: 7-14 Werktage</li></ul>",LightCraft DE,LED Strip,"led, rgb, strip, beleuchtung, gaming, zimmer",true,19.99,29.99,true,true,https://cjdropshipping.com/image/cache/catalog/New_images/WS2811/WS2811_Colorful_Strip-800x800.jpg
neon-led-farb-streifen-45cm,"Neon LED Farbstreifen 45cm","<p>Der <strong>Neon LED Farbstreifen</strong> in 45cm – perfekt für Unter-Bett Beleuchtung, Schreibtische, Regale und kreative DIY-Projekte. 8 Farben wählbar!</p><ul><li>Länge: 45cm oder 90cm wählbar</li><li>8 Farben zur Auswahl (Blau, Grün, Lila, Rot, Weiß, RGB...)</li><li>Selbstklebende Rückseite</li><li>Lieferzeit: 7-14 Werktage</li></ul>",LightCraft DE,LED Strip,"led, neon, farbe, diy, dekoration, regal",true,12.99,19.99,true,true,
led-sensor-nachtlicht-1m,"LED Nachtlicht Sensor Streifen 1m","<p>Intelligenter <strong>LED Sensor Nachtlicht Streifen</strong> – leuchtet automatisch wenn du aufstehst! Perfekt unter dem Bett, an der Treppe oder im Flur. Bewegungssensor + Dämmerungssensor.</p><ul><li>Automatischer Bewegungssensor</li><li>Warmweiß (EU Stecker)</li><li>Längen: 1M bis 5M wählbar</li><li>Kein Aufwachen im Dunkeln mehr</li><li>Lieferzeit: 7-14 Werktage</li></ul>",LightCraft DE,LED Strip,"led, sensor, nachtlicht, bett, treppe, bewegungssensor",true,24.99,34.99,true,true,
rgb-led-lichtleiste-auto,"RGB LED Lichtleiste Auto Universal","<p>Gib deinem Auto ein professionelles Tuning-Look mit der <strong>RGB LED Lichtleiste</strong>! Mit Fernbedienung, wasserdicht, universell montierbar. 16 Farben + 4 Modi.</p><ul><li>12V KFZ-kompatibel</li><li>Wasserdicht IP65</li><li>16 Farben + Farbwechsel-Modi</li><li>Fernbedienung inklusive</li><li>Lieferzeit: 7-14 Werktage</li></ul>",LightCraft DE,LED Strip,"led, auto, kfz, tuning, rgb, wasserdicht",true,16.99,24.99,true,true,
smart-led-strip-wifi-app,"Smart LED Strip WiFi App-Steuerung 5m","<p><strong>Smart LED Strip</strong> mit WiFi-Steuerung per Smartphone App! Alexa & Google Home kompatibel. Setze Szenen, Timer und Farbverläufe per App von überall.</p><ul><li>App-Steuerung (iOS & Android)</li><li>Alexa & Google Home kompatibel</li><li>5 Meter, RGB + Warmweiß</li><li>Musik-Sync Funktion</li><li>Lieferzeit: 7-14 Werktage</li></ul>",LightCraft DE,LED Strip,"led, smart, wifi, alexa, google home, app",true,29.99,44.99,true,true,
